{
  "$schema": "https://json-schema.org/draft/2020-12/schema",
  "$id": "https://seer.genesistheory.org/schemas/forecast_object.schema.json",
  "title": "Seer Forecast Object",
  "description": "The complete forecast lifecycle object. Contains the three locked phases (specification, evidence, forecast), optional monitoring notes, and resolution data when scored.",
  "type": "object",
  "required": ["id", "created", "status", "specification"],
  "properties": {
    "id": {
      "type": "string",
      "pattern": "^SEER-[0-9]{4}-[0-9]{4}$",
      "description": "Unique forecast identifier. Format: SEER-YYYY-NNNN. E.g., SEER-2026-0001."
    },
    "created": {
      "type": "string",
      "format": "date-time",
      "description": "ISO 8601 timestamp of forecast object creation."
    },
    "status": {
      "type": "string",
      "enum": ["draft", "locked", "live", "resolved", "scored", "archived", "moot"],
      "description": "Current lifecycle state. Draft: in progress. Locked: all three locks confirmed. Live: published and monitoring. Resolved: horizon reached. Scored: accuracy computed. Archived: no longer active. Moot: invalidated by exogenous event."
    },
    "specification": {
      "$ref": "specification.schema.json",
      "description": "Lock A: the forecastable object definition."
    },
    "specification_hash": {
      "type": "string",
      "description": "SHA-256 hash of the specification JSON at lock time."
    },
    "specification_locked_at": {
      "type": "string",
      "format": "date-time",
      "description": "UTC timestamp of Lock A."
    },
    "evidence_summary": {
      "$ref": "evidence_summary.schema.json",
      "description": "Lock B: the evidence basis."
    },
    "evidence_hash": {
      "type": "string",
      "description": "SHA-256 hash of the evidence summary JSON at lock time."
    },
    "evidence_locked_at": {
      "type": "string",
      "format": "date-time",
      "description": "UTC timestamp of Lock B."
    },
    "forecast": {
      "$ref": "forecast.schema.json",
      "description": "Lock C: the prediction."
    },
    "forecast_hash": {
      "type": "string",
      "description": "SHA-256 hash of the forecast JSON at lock time."
    },
    "forecast_locked_at": {
      "type": "string",
      "format": "date-time",
      "description": "UTC timestamp of Lock C."
    },
    "monitoring": {
      "type": "object",
      "properties": {
        "landing_confidence": {
          "type": "number",
          "minimum": 0,
          "maximum": 1,
          "description": "Current confidence estimate, updated at check-ins. Mutable — not part of any lock."
        },
        "notes": {
          "type": "array",
          "items": {
            "type": "object",
            "required": ["timestamp", "observation"],
            "properties": {
              "timestamp": {
                "type": "string",
                "format": "date-time"
              },
              "observation": {
                "type": "string"
              }
            }
          },
          "description": "Chronological monitoring notes. Append-only."
        }
      },
      "description": "Optional mutable monitoring layer. Lightweight notation in v0."
    },
    "resolution": {
      "type": "object",
      "properties": {
        "resolved_at": {
          "type": "string",
          "format": "date-time"
        },
        "outcome_evidence": {
          "type": "array",
          "items": { "type": "string" },
          "description": "Evidence documenting what actually happened."
        },
        "component_scores": {
          "type": "array",
          "items": {
            "type": "object",
            "required": ["criterion", "outcome", "score"],
            "properties": {
              "criterion": { "type": "string" },
              "outcome": { "type": "string" },
              "score": {
                "type": "number",
                "minimum": 0,
                "maximum": 1
              }
            }
          }
        },
        "forecast_score": {
          "type": "number",
          "minimum": 0,
          "maximum": 1,
          "description": "Weighted aggregate of component scores."
        },
        "brier_score": {
          "type": "number",
          "description": "Brier score for the primary prediction. Lower is better. 0 = perfect, 0.25 = coin flip."
        },
        "log_score": {
          "type": "number",
          "description": "Logarithmic scoring rule. More sensitive to confident wrong predictions."
        },
        "differential_accuracy": {
          "type": "number",
          "description": "Seer score minus baseline score. Positive = Seer outperformed. This is the metric that earns Genesis its place."
        },
        "baseline_outcome": {
          "type": "string",
          "description": "What the declared baseline actually predicted and how it scored."
        },
        "calibration_notes": {
          "type": "string",
          "description": "Analyst notes on what the scoring reveals about model calibration."
        }
      },
      "description": "Populated when the forecast resolves and is scored."
    },
    "retrodiction": {
      "type": "object",
      "properties": {
        "prediction_date": {
          "type": "string",
          "format": "date",
          "description": "The declared temporal cutoff. Research was restricted to evidence available on or before this date."
        },
        "time_boxed": {
          "type": "boolean",
          "description": "Confirmation that temporal cutoff was enforced."
        },
        "scorecard": {
          "type": "object",
          "properties": {
            "predicted": { "type": "string" },
            "actual": { "type": "string" },
            "deviation": { "type": "string" },
            "calibration": { "type": "string" }
          }
        }
      },
      "description": "Present only for retrodiction runs. Records the temporal cutoff and scoring against known outcomes."
    },
    "lineage": {
      "type": "object",
      "properties": {
        "predecessor": {
          "type": "string",
          "description": "ID of the forecast this one supersedes, if any."
        },
        "successor": {
          "type": "string",
          "description": "ID of the forecast that supersedes this one, if any."
        },
        "family": {
          "type": "string",
          "description": "Prediction family ID if this forecast shares a research pass with others."
        }
      }
    }
  },
  "additionalProperties": false
}
