{
  "id": "SEER-2026-0003",
  "created": "2026-03-23T23:54:16.272034+00:00",
  "status": "locked",
  "specification": {
    "system": "Tesla Automotive Division (NYSE: TSLA) — vehicle design, manufacturing, sales, service, FSD/Autopilot software, and robotaxi operations. Excludes Energy/Storage segment (separate P&L, distinct field conditions, divergent trajectory). ~125,665 employees, ~$77B automotive revenue (2025), 1.64M deliveries (2025).",
    "scope_notes": "Musk's cross-company leadership portfolio (SpaceX, xAI, X, Neuralink, Boring Company, DOGE) treated as organizational input to Tesla Automotive, not a separate system — but external activities assessed through Navigator Field-Emission Audit for field-level impact. Cybercab and Model Q included as automotive products. Energy/Storage excluded per segment separation.",
    "object_type": "company",
    "target_class": "trajectory",
    "target": "Tesla Automotive's trajectory over 6 months (March–September 2026), focusing on whether the compound I-R bottleneck (I=2.0, R=2.5), frozen navigator correction rate (lambda ≈ 0), navigator field-emissions at civilizational scale, and delusion cascade (delta-Phi → I → R → F) produce continued erosion of conversion capacity, margin, and boundary portfolio — or whether an exogenous catalyst breaks the triple trap.",
    "horizon": {
      "length": "6 months",
      "start_date": "2026-03-23",
      "end_date": "2026-09-30"
    },
    "resolution_criteria": [
      {
        "criterion": "No strategic recalibration: leadership does not publicly acknowledge brand damage as structural or revise growth targets to match delivery trajectory",
        "type": "qualitative",
        "threshold": "No public acknowledgment with remedial action; no guidance aligned to actual trend; continued framing of Tesla as growth/AI company despite declining automotive deliveries",
        "weight": 0.2
      },
      {
        "criterion": "Third consecutive year of delivery decline — 2026 deliveries below 2025 level of 1.64M units",
        "type": "threshold",
        "threshold": "Full-year 2026 deliveries < 1.64M (resolution at year-end; H2 trajectory measurable by September from H1 actuals)",
        "weight": 0.15
      },
      {
        "criterion": "European market share falls below 7% in any quarter through September 2026, driven by civilizational-scale identity rejection",
        "type": "threshold",
        "threshold": "European EV registration share < 7% in any quarter through Q3 2026",
        "weight": 0.15
      },
      {
        "criterion": "No FSD Level 3+ approval in any US jurisdiction by end of 2026",
        "type": "binary",
        "threshold": "No state or federal approval for unsupervised autonomous driving by December 2026",
        "weight": 0.1
      },
      {
        "criterion": "Cybercab production remains below 25,000 units per quarter through 2026",
        "type": "threshold",
        "threshold": "No quarter exceeds 25K Cybercab units produced in 2026",
        "weight": 0.1
      },
      {
        "criterion": "Brand loyalty stays below 55% — no recovery from the 73% → 49.9% collapse",
        "type": "threshold",
        "threshold": "Brand repeat purchase rate remains below 55% through September 2026",
        "weight": 0.15
      },
      {
        "criterion": "Automotive gross margin (excluding regulatory credits) stays below 18%, confirming margin compression trajectory and R→F cascade propagation",
        "type": "threshold",
        "threshold": "No quarter exceeds 18% auto GM ex-credits through Q3 2026",
        "weight": 0.15
      }
    ],
    "baseline": {
      "source": "Composite: Wall Street analyst consensus (Bloomberg composite), conventional strategy frameworks (McKinsey/BCG automotive transformation models), EV sector analyst consensus",
      "position": "Consensus: Tesla faces headwinds but will adapt — pricing adjustments stabilize demand, Cybercab launch provides growth catalyst, brand damage is cyclical not structural, strong balance sheet ($44.1B cash) funds transformation. Most analysts rate Hold with expectation of eventual recovery. No consensus analyst predicts three consecutive years of delivery decline or structural brand fracture.",
      "divergence": "Genesis predicts continued erosion (51% base) with significant downside risk (31%), driven by structural mechanisms invisible to consensus: (1) I-channel bottleneck prevents strategic recalibration — the system literally cannot see what's wrong; (2) brand damage is identity-based, not cyclical — progressive and European buyers have exited the consideration set entirely; (3) navigator field-emissions at civilizational scale (political alignment, nazi salute perception, X destruction, DOGE) created ~55-60% of R-field hostility with near-zero reversibility; (4) cash fortress delays but cannot prevent cascade propagation because F-channel strength doesn't repair I or R channels.",
      "hinge": "The triple trap: I-channel model error (delta-Phi = 0.72) × boundary identity-closure (Pi contracted 43% in 2 years) × locked navigation (C_nav = 0.85 on wrong map, g = Dictate, lambda ≈ 0). If any element of the triple trap breaks — lambda unfreezes, boundaries reopen, or navigation diversifies — baselines may be closer to correct. If the triple trap holds, Genesis predicts outcomes no baseline framework can explain: a system with $44B cash and functional manufacturing that cannot execute any transformation requiring I-channel or R-channel health."
    },
    "shock_sensitivity": "high",
    "forecast_class": "standard",
    "evidence_sufficiency": "strong",
    "publication_class": "research_grade"
  },
  "specification_hash": "35a1ee1c10cd7842c88cb1063380e2ef2b88850dd6be1f74f2119650a38bbd95",
  "specification_locked_at": "2026-03-23T23:54:16.272222+00:00",
  "evidence_summary": {
    "key_findings": [
      "I-channel scores 2.0 (Critical): all four I ≤ 2 conditions met. Narrative dominates data ('AI/robotics company' pivot while deliveries decline). Delta-Phi = 0.72 and widening. Truth-tellers marginalized (5 senior departures 2023-2024 including potential CEO successor Kirkhorn). Forecasts systematically wrong without correction: 9+ years of FSD misses, robotaxi 90% shortfall (promised 1,500, delivered ~135), promised 20-30% growth for 2025 but delivered -8.6%.",
      "R-channel scores 2.5 (Strained-low), revised from 3.0 after Navigator Field-Emission Audit. Brand loyalty collapsed 73% → 49.9%. NBER peer-reviewed study quantified 1.0-1.26M lost sales from partisan effect. Democratic buyer share 40% → 15%. Europe sales -27.8% YoY (Germany -72% from peak). Trust recovery scores 1.0 — zero evidence of brand recovery initiatives.",
      "F-channel scores 6.5 (Functional): $44.1B cash/investments (record), investment grade credit (BBB/Baa3). But automotive GM halved from 28.5% (2022) to 15.4% (2025). Operating margin compressed from 16.8% to 4.6%. Regulatory credits declining 28% ($1.99B) with projected 75% further decline by 2026. FCF projected negative 2026-2027 (JPMorgan, Goldman).",
      "S-channel scores 4.5 (Strained): four major factories globally with $40.6B net PP&E, but only 3 named executives (Musk, Taneja, Zhu). CEO splits attention across 6 companies. 14%+ layoffs April 2024 (~19K employees). Eliminated entire Supercharger team and public policy division. Zero succession depth.",
      "Compound bottleneck set B = {I, R} with gap of 0.5. These two channels form a reinforcing loop: low I prevents sensing R-channel damage → R continues degrading → degraded R generates negative signals → low I can't process them. Same navigator degrades both: frozen lambda locks I, while external conduct (political activity, X destruction, nazi salute perception) degrades R through field poisoning.",
      "Navigator Field-Emission Audit identifies six emission channels at civilizational scale: (1) DOGE/political alignment, (2) nazi salute perception at inauguration, (3) X/Twitter destruction, (4) EU DSA proceedings creating cross-domain regulatory antagonism, (5) Sweden strike (29 months), (6) labor relations hostility. Navigator-attributed share of chi_R degradation: ~55-60%. Emissions compound multiplicatively on R-channel with near-zero reversibility.",
      "Lambda ≈ 0.02 (frozen): five documented events with consistent pattern — disconfirming evidence triggers escalation, reframing, or silence, never recalibration. FSD timeline misses (2014-2025): new deadlines promised without correction. BYD overtaking: reframed as 'we're an AI company.' Brand loyalty -23pt: zero organizational response. DOGE Q1 net income -71%: escalated promises. Robotaxi 90% shortfall: 'agonizingly slow' qualifier.",
      "Psi_norm = 0.010 (Terminal): robust to perturbation — even with generous simultaneous adjustments across I, A, eta, and chi(Phi), classification remains Terminal. Sensitivity analysis shows I must reach 4.0+ to escape, requiring lambda unfreeze for which no evidence exists.",
      "Pi_avail contracted 43% in 2 years (from ~2.0M to ~1.14M addressable units). B002 (US progressive) identity-closed: Q10 = 3.0, Y(B) = 0.00. B003 (Europe) closing toward identity-closure: Q10 = 3.0, approaching same pattern. B008 (Canada) opens into hostile R-field pre-poisoned by DOGE/trade war association. Factory capacity 2.35M against accessible demand ~1.14M = 1.21M units of idle infrastructure.",
      "Deferral classification: D_r (Resistance) — all six indicators confirmed. Response to disconfirmation: reject/rationalize. Exploration: suppressed. Margin: declining. Internal discourse: 'we're fine.' RUIN applied to accurate signals (Dojo abandoned, Supercharger team eliminated). Lambda: decreasing.",